{
  "schema_version": "agent-run-event.v0",
  "event_id": "01JZ0000000000000000000000",
  "kind": "agent.run.started",
  "ts": "2026-07-02T12:00:00Z",
  "source": {
    "repo": "heimgewebe/grabowski",
    "component": "grabowski",
    "run_id": "run-20260702-120000"
  },
  "subject": {
    "repo": "heimgewebe/chronik",
    "branch": "docs/agent-run-v0",
    "head": "a44965d"
  },
  "trust_tier": "declared",
  "status": "active",
  "caused_by": [],
  "evidence_refs": ["local-run:run-20260702-120000"],
  "data": {
    "result": "started"
  }
}
